{
  "schemaVersion": 1, "richDocumentVersion": 2, "categoryId": "laplace-fourier-transforms", "articleId": "fourier-transform-table", "title": "Practical Fourier transform table", "displayOrder": 9,
  "aliases": ["Fourier table", "Fourier transform table", "common Fourier transforms", "Fourier pairs"],
  "keywords": ["fourier-angular-v1", "Gaussian transform", "sinc transform", "distributional transform"],
  "notation": {"blocks": [{"type": "paragraph", "runs": [{"type": "text", "text": "Every row uses convention ID fourier-angular-v1."}]}]},
  "definitions": {"blocks": [{"type": "paragraph", "runs": [{"type": "text", "text": "Ordinary-function and distributional rows are labeled separately. The table is practical, not exhaustive."}]}]},
  "results": {"blocks": [{"type": "table", "caption": [{"type": "text", "text": "Common angular-frequency Fourier pairs"}], "headers": [[{"type": "text", "text": "Function"}], [{"type": "text", "text": "Transform"}], [{"type": "text", "text": "Convention ID"}]], "rows": [
    [{"blocks": [{"type": "paragraph", "runs": [{"type": "inlineMath", "tex": "e^{-a|x|},\\ a>0"}]}]}, {"blocks": [{"type": "paragraph", "runs": [{"type": "inlineMath", "tex": "2a/(a^2+\\omega^2)"}]}]}, {"blocks": [{"type": "paragraph", "runs": [{"type": "text", "text": "fourier-angular-v1"}]}]}],
    [{"blocks": [{"type": "paragraph", "runs": [{"type": "inlineMath", "tex": "\\mathbf1_{[-a,a]}(x),\\ a>0"}]}]}, {"blocks": [{"type": "paragraph", "runs": [{"type": "inlineMath", "tex": "2\\sin(a\\omega)/\\omega"}]}]}, {"blocks": [{"type": "paragraph", "runs": [{"type": "text", "text": "fourier-angular-v1"}]}]}],
    [{"blocks": [{"type": "paragraph", "runs": [{"type": "inlineMath", "tex": "e^{-x^2/2}"}]}]}, {"blocks": [{"type": "paragraph", "runs": [{"type": "inlineMath", "tex": "\\sqrt{2\\pi}e^{-\\omega^2/2}"}]}]}, {"blocks": [{"type": "paragraph", "runs": [{"type": "text", "text": "fourier-angular-v1"}]}]}],
    [{"blocks": [{"type": "paragraph", "runs": [{"type": "inlineMath", "tex": "1"}]}]}, {"blocks": [{"type": "paragraph", "runs": [{"type": "inlineMath", "tex": "2\\pi\\delta(\\omega)"}, {"type": "text", "text": " (distribution)"}]}]}, {"blocks": [{"type": "paragraph", "runs": [{"type": "text", "text": "fourier-angular-v1"}]}]}],
    [{"blocks": [{"type": "paragraph", "runs": [{"type": "inlineMath", "tex": "\\delta(x-a)"}]}]}, {"blocks": [{"type": "paragraph", "runs": [{"type": "inlineMath", "tex": "e^{-i\\omega a}"}, {"type": "text", "text": " (distribution)"}]}]}, {"blocks": [{"type": "paragraph", "runs": [{"type": "text", "text": "fourier-angular-v1"}]}]}]
  ]}]},
  "conditions": {"blocks": [{"type": "list", "ordered": false, "items": [[{"type": "text", "text": "The first three rows are ordinary integral pairs; the constant and delta rows are tempered-distribution identities."}], [{"type": "text", "text": "At "}, {"type": "inlineMath", "tex": "\\omega=0"}, {"type": "text", "text": ", interpret the indicator transform by its continuous limit "}, {"type": "inlineMath", "tex": "2a"}, {"type": "text", "text": "."}], [{"type": "text", "text": "Scaling and shifts must follow fourier-angular-v1."}]]}]},
  "examples": [{"title": "Transform a normalized box", "document": {"blocks": [{"type": "displayMath", "tex": "\\widehat{\\frac1{2a}\\mathbf1_{[-a,a]}}(\\omega)=\\frac{\\sin(a\\omega)}{a\\omega},\\qquad \\widehat f(0)=1."}]}}],
  "pitfalls": {"blocks": [{"type": "list", "ordered": false, "items": [[{"type": "text", "text": "Do not treat delta identities as convergent ordinary integrals."}], [{"type": "text", "text": "Sinc notation is ambiguous; write its argument and normalization explicitly."}]]}]},
  "relatedReferences": ["math-reference/laplace-fourier-transforms/fourier-transform-conventions", "math-reference/laplace-fourier-transforms/fourier-transform-properties", "math-reference/laplace-fourier-transforms/convolution-parseval-distributions"], "relatedProblems": [],
  "sources": [{"label": "MIT Fourier transform lecture notes", "url": "https://math.mit.edu/icg/resources/notes330.pdf"}],
  "rights": {"sourceUrl": "https://math.mit.edu/icg/resources/notes330.pdf", "attribution": "Original MyPutnam practical table informed by MIT Fourier-analysis notes.", "copyrightHolder": "Massachusetts Institute of Technology and course authors", "licenseBasis": "Standard pairs are arranged in an original convention-labeled table.", "redistributionStatus": "cleared"}
}
