{
  "schemaVersion": 1, "richDocumentVersion": 2, "categoryId": "laplace-fourier-transforms", "articleId": "convolution-and-ode", "title": "Laplace convolution and ODEs", "displayOrder": 5,
  "aliases": ["Laplace convolution", "Laplace ODE", "convolution theorem Laplace", "transfer function"],
  "keywords": ["laplace-one-sided-v1", "initial-value problem", "zero-state response", "impulse response"],
  "notation": {"blocks": [{"type": "paragraph", "runs": [{"type": "text", "text": "Convention ID laplace-one-sided-v1 uses the causal convolution "}, {"type": "inlineMath", "tex": "(f*g)(t)=\\int_0^t f(\\tau)g(t-\\tau)\\,d\\tau"}, {"type": "text", "text": "."}]}]},
  "definitions": {"blocks": [{"type": "displayMath", "tex": "\\mathcal L\\{f*g\\}(s)=F(s)G(s)."}]},
  "results": {"blocks": [{"type": "paragraph", "runs": [{"type": "text", "text": "Transform a constant-coefficient initial-value ODE, insert every initial term from the derivative rules, solve algebraically for "}, {"type": "inlineMath", "tex": "Y(s)"}, {"type": "text", "text": ", and invert."}]}, {"type": "paragraph", "runs": [{"type": "text", "text": "With zero initial data, multiplication by a transfer function in the transform domain becomes convolution with its impulse response in time."}]}]},
  "conditions": {"blocks": [{"type": "list", "ordered": false, "items": [[{"type": "text", "text": "The standard causal convolution theorem assumes compatible existence regions."}], [{"type": "text", "text": "Nonzero initial conditions contribute separate polynomial terms in "}, {"type": "inlineMath", "tex": "s"}, {"type": "text", "text": " and must not be dropped."}], [{"type": "text", "text": "Zero-state convolution describes the forcing response; add the zero-input response when initial data are nonzero."}]]}]},
  "examples": [{"title": "Solve a first-order initial-value problem", "document": {"blocks": [{"type": "paragraph", "runs": [{"type": "text", "text": "For "}, {"type": "inlineMath", "tex": "y'+y=1"}, {"type": "text", "text": " and "}, {"type": "inlineMath", "tex": "y(0)=0"}, {"type": "text", "text": ","}]}, {"type": "displayMath", "tex": "(s+1)Y(s)=\\frac1s,\\qquad Y(s)=\\frac1{s(s+1)},\\qquad y(t)=1-e^{-t}."}, {"type": "paragraph", "runs": [{"type": "text", "text": "Differentiation verifies the ODE and initial value."}]}]}}],
  "pitfalls": {"blocks": [{"type": "list", "ordered": false, "items": [[{"type": "text", "text": "Laplace convolution is an integral over the causal interval, not pointwise multiplication."}], [{"type": "text", "text": "Check the transformed derivative signs before partial fractions."}]]}]},
  "relatedReferences": ["math-reference/differential-equations/first-order-linear", "math-reference/laplace-fourier-transforms/laplace-properties", "math-reference/laplace-fourier-transforms/inverse-laplace"], "relatedProblems": [],
  "sources": [{"label": "MIT OpenCourseWare 18.03 supplementary notes, Convolution", "url": "https://ocw.mit.edu/courses/18-03-differential-equations-spring-2010/resources/mit18_031s10_chapter_19/"}],
  "rights": {"sourceUrl": "https://ocw.mit.edu/courses/18-03-differential-equations-spring-2010/resources/mit18_031s10_chapter_19/", "attribution": "Original MyPutnam exposition informed by MIT OpenCourseWare.", "copyrightHolder": "Massachusetts Institute of Technology and course authors", "licenseBasis": "Standard convolution and ODE methods are presented in original prose with an original check.", "redistributionStatus": "cleared"}
}
