{
  "schemaVersion": 1, "richDocumentVersion": 2, "categoryId": "laplace-fourier-transforms", "articleId": "laplace-transform-table", "title": "Practical Laplace transform table", "displayOrder": 3,
  "aliases": ["Laplace table", "Laplace transform table", "common Laplace transforms", "Laplace pairs"],
  "keywords": ["laplace-one-sided-v1", "transform pairs", "sine Laplace", "exponential Laplace"],
  "notation": {"blocks": [{"type": "paragraph", "runs": [{"type": "text", "text": "Every row uses convention ID laplace-one-sided-v1."}]}]},
  "definitions": {"blocks": [{"type": "paragraph", "runs": [{"type": "text", "text": "The table is a practical core, not an exhaustive catalog. Parameters satisfy the row conditions."}]}]},
  "results": {"blocks": [{"type": "table", "caption": [{"type": "text", "text": "Common one-sided Laplace pairs"}], "headers": [[{"type": "text", "text": "Function"}], [{"type": "text", "text": "Transform and ROC"}], [{"type": "text", "text": "Convention ID"}]], "rows": [
    [{"blocks": [{"type": "paragraph", "runs": [{"type": "inlineMath", "tex": "1"}]}]}, {"blocks": [{"type": "paragraph", "runs": [{"type": "inlineMath", "tex": "1/s,\\ \\operatorname{Re}s>0"}]}]}, {"blocks": [{"type": "paragraph", "runs": [{"type": "text", "text": "laplace-one-sided-v1"}]}]}],
    [{"blocks": [{"type": "paragraph", "runs": [{"type": "inlineMath", "tex": "t^n,\\ n=0,1,\\ldots"}]}]}, {"blocks": [{"type": "paragraph", "runs": [{"type": "inlineMath", "tex": "n!/s^{n+1},\\ \\operatorname{Re}s>0"}]}]}, {"blocks": [{"type": "paragraph", "runs": [{"type": "text", "text": "laplace-one-sided-v1"}]}]}],
    [{"blocks": [{"type": "paragraph", "runs": [{"type": "inlineMath", "tex": "e^{at}"}]}]}, {"blocks": [{"type": "paragraph", "runs": [{"type": "inlineMath", "tex": "1/(s-a),\\ \\operatorname{Re}s>\\operatorname{Re}a"}]}]}, {"blocks": [{"type": "paragraph", "runs": [{"type": "text", "text": "laplace-one-sided-v1"}]}]}],
    [{"blocks": [{"type": "paragraph", "runs": [{"type": "inlineMath", "tex": "\\sin bt"}]}]}, {"blocks": [{"type": "paragraph", "runs": [{"type": "inlineMath", "tex": "b/(s^2+b^2),\\ \\operatorname{Re}s>0"}]}]}, {"blocks": [{"type": "paragraph", "runs": [{"type": "text", "text": "laplace-one-sided-v1"}]}]}],
    [{"blocks": [{"type": "paragraph", "runs": [{"type": "inlineMath", "tex": "\\cos bt"}]}]}, {"blocks": [{"type": "paragraph", "runs": [{"type": "inlineMath", "tex": "s/(s^2+b^2),\\ \\operatorname{Re}s>0"}]}]}, {"blocks": [{"type": "paragraph", "runs": [{"type": "text", "text": "laplace-one-sided-v1"}]}]}],
    [{"blocks": [{"type": "paragraph", "runs": [{"type": "inlineMath", "tex": "u(t-a),\\ a\\ge0"}]}]}, {"blocks": [{"type": "paragraph", "runs": [{"type": "inlineMath", "tex": "e^{-as}/s,\\ \\operatorname{Re}s>0"}]}]}, {"blocks": [{"type": "paragraph", "runs": [{"type": "text", "text": "laplace-one-sided-v1"}]}]}]
  ]}]},
  "conditions": {"blocks": [{"type": "list", "ordered": false, "items": [[{"type": "text", "text": "Each region of convergence shown is for the stated right-sided function and parameters."}], [{"type": "text", "text": "At removable parameter values, simplify or take a limit."}], [{"type": "text", "text": "Use properties to generate shifted, scaled, differentiated, or integrated variants."}]]}]},
  "examples": [{"title": "Combine table entries", "document": {"blocks": [{"type": "displayMath", "tex": "\\mathcal L\\{3e^{-2t}-4\\sin(5t)\\}=\\frac3{s+2}-\\frac{20}{s^2+25},\\qquad \\operatorname{Re}s>0."}]}}],
  "pitfalls": {"blocks": [{"type": "list", "ordered": false, "items": [[{"type": "text", "text": "The common convergence half-plane is the intersection of the terms' regions."}], [{"type": "text", "text": "Keep the sine numerator parameter."}]]}]},
  "relatedReferences": ["math-reference/laplace-fourier-transforms/laplace-properties", "math-reference/laplace-fourier-transforms/inverse-laplace", "math-reference/trigonometry/angle-addition-identities"], "relatedProblems": [],
  "sources": [{"label": "MIT OpenCourseWare Laplace transform table", "url": "https://ocw.mit.edu/courses/18-03sc-differential-equations-fall-2011/resources/mit18_03scf11_laptable29/"}],
  "rights": {"sourceUrl": "https://ocw.mit.edu/courses/18-03sc-differential-equations-fall-2011/resources/mit18_03scf11_laptable29/", "attribution": "Original MyPutnam practical table informed by MIT OpenCourseWare.", "copyrightHolder": "Massachusetts Institute of Technology and course authors", "licenseBasis": "Standard transform pairs are arranged in an original compact table with an original example.", "redistributionStatus": "cleared"}
}
